S.No.,User,Rating,Review_summary,Customer_info,Date,Upvote,Downvote,Review_detail
919,Flipkart Customer,3,Nice,"Certified Buyer, Chennai",Flipkart Customer,1,0,Producing huge heat compared to other models
920,SHUBHAM  RAM,5,Wonderful,"Certified Buyer, Mayurbhanj District",SHUBHAM  RAM,1,0,Just Awesome!!
921,shaik sarfaraz,5,Simply awesome,"Certified Buyer, Narayankhed",shaik sarfaraz,1,0,Best 🫡
922,Rajeev  Chaudhary,4,Good quality product,"Certified Buyer, Agra Division",Rajeev  Chaudhary,1,0,Good product but expensive
923,Vaseem Ahmad,4,Really Nice,"Certified Buyer, Aligarh",Vaseem Ahmad,0,0,Everything is good
924,Arun Kumar V,3,Decent product,"Certified Buyer, Chennai",Arun Kumar V,1,0,Super product
925,Rakesh Banjara,5,Best in the market!,"Certified Buyer, Indore",Rakesh Banjara,0,0,Best product I phone 14 128 by FlipkartThank you Flipkart My name Rakesh Banjara
926,Manjunath Vangi,5,Great product,"Certified Buyer, Bengaluru",Manjunath Vangi,1,0,"What a product. Impressed with its,- Performance - Battery back up- Camera- FeaturesOverall am impressed with this product."
927,RAVI  TOMAR ,5,Terrific purchase,"Certified Buyer, Morena",RAVI  TOMAR ,1,0,Nice products and earliest delivery
928,Flipkart Customer,5,Terrific,"Certified Buyer, Baleshwar",Flipkart Customer,1,0,Great product at good price.
929,Priyanka Pavra,5,Just wow!,"Certified Buyer, New Delhi",Priyanka Pavra,0,0,Picture quality is amazing
930,Chandrashekhar  MS,5,Highly recommended,"Certified Buyer, Bengaluru",Chandrashekhar  MS,1,0,Superb
931,MANI BHUSHAN KUMAR,5,Perfect product!,"Certified Buyer, Nagpur",MANI BHUSHAN KUMAR,0,0,Nice colour go for it.
932,Vigneshwaran Manian,5,Terrific,"Certified Buyer, Mysuru",Vigneshwaran Manian,0,0,Superb LookExcellent CameraMarvellous Battery Life
933,Shubham  Jaiswal sk7,5,Fabulous!,"Certified Buyer, Jaunpur District",Shubham  Jaiswal sk7,1,0,Awesome 😍❤️🤗
934,Avyukth Prabhu,5,Super!,"Certified Buyer, Coimbatore",Avyukth Prabhu,1,0,"Perfect of All Times.Best in Battery Life, Charging Speed,Quality ,Camera and the Comfort of its Size..Love itCamera is Insane for Camera Lovers. Night Modes are Excellent"
935,Shabir Khan,5,Awesome,"Certified Buyer, Kolkata",Shabir Khan,0,0,Product is very cool and i loved it his performance 😊
936,Mandeep Bhullar,5,Wonderful,"Certified Buyer, Zirakpur",Mandeep Bhullar,0,0,Great product.Fantastic performance.
937,Ravi Ravi,5,Wonderful,"Certified Buyer, Fatehabad District",Ravi Ravi,1,0,Good
938,Flipkart Customer,5,Fabulous!,"Certified Buyer, Madhyamgram",Flipkart Customer,1,0,This is amazing
939,Vikram Gangurde,5,Mind-blowing purchase,"Certified Buyer, Nashik",Vikram Gangurde,1,0,Product colour very beautiful and camera quality excellent.
940,Anirudh Vempaty,4,Wonderful,"Certified Buyer, Hyderabad",Anirudh Vempaty,1,0,This is my first time using an iPhone and the experience has been nothing but seamless and amazing to say nonetheless 💯The only issue thus far has been a lil bit overheating while charging
941,Flipkart Customer,5,Terrific purchase,"Certified Buyer, Fatehabad District",Flipkart Customer,1,0,Ncie
942,PRITAM MONDAL,5,Great product,"Certified Buyer, Bidhan Nagar",PRITAM MONDAL,1,0,My first iphone. Thanks filpkart
943,Gautam Kumar,5,Good,"Certified Buyer, Patna",Gautam Kumar,1,0,Ok
944,Daksh Dep,5,Best in the market!,"Certified Buyer, Fatehabad District",Daksh Dep,1,0,Good
945,manish jain,5,Utterly Disappointed,"Certified Buyer, Thane",manish jain,1,0,This is worst product I recieved in my lifetime.Always regret.Not working my iphone properly
946,Flipkart Customer,5,Great product,"Certified Buyer, Fatehabad District",Flipkart Customer,1,0,Nice
947,Karthik Nandaluri,4,Nice product,"Certified Buyer, Sriperumbudur",Karthik Nandaluri,1,0,Thank you Flipkart Camera awesome Display good
948,Flipkart Customer,5,Terrific,"Certified Buyer, Ahmedabad",Flipkart Customer,1,0,"What is more there to say for any Apple product amazing in its style, innovation memory camera every thing just comes to a perfection that is what what we call Apple"
949,Pravin Kumar,5,Brilliant,"Certified Buyer, Bhagalpur",Pravin Kumar,1,0,Camera betray display such a wow
950,Suryendu,5,Great product,"Certified Buyer, New Delhi",Suryendu,1,0,Excellent phone
951,Vishal Bhandari,4,Nice product,"Certified Buyer, New Delhi",Vishal Bhandari,1,0,Good product
952,Shivam Gupta,1,Absolute rubbish!,"Certified Buyer, Hardoi",Shivam Gupta,0,1,Disgusting
953,Sourabh Singh,5,Terrific purchase,"Certified Buyer, Pune",Sourabh Singh,1,0,"I am using the product since quite a while now, I was previously having XR and this is 100% an upgrade on the same. Battery life is good and phone is a bit handy as well, though not as good as mini phones. Camera has definitely improved a lot in last 4 yrs and that's a massive upgrade. Altogether a great product and a no brainer if you are looking for a 5g handset with decent performance."
954,Senthil L,5,Great product,"Certified Buyer, Karunagappally",Senthil L,1,0,iPhone is iPhone. It was an upgrade from iPhone x to iPhone 14 . Its always for my wife.100% satisfied with product and delivery
955,Flipkart Customer,5,Simply awesome,"Certified Buyer, Hyderabad",Flipkart Customer,1,0,Excellent
956,Naveen Kasoji,5,Fabulous!,"Certified Buyer, Hyderabad",Naveen Kasoji,1,0,Excellent and battery performance also good
957,KUSHAL  Kasaudhan ,5,Fabulous!,"Certified Buyer, Gorakhpur",KUSHAL  Kasaudhan ,1,0,Very good product
958,AKASH R O C K I E,5,Highly recommended,"Certified Buyer, New Delhi",AKASH R O C K I E,1,0,Wonderful product ❤️
959,raj kiran,4,Value-for-money,"Certified Buyer, New Delhi",raj kiran,1,0,Good
960,Bhushan rajput,5,Excellent,"Certified Buyer, Nashik",Bhushan rajput,0,0,Nice li
961,Sunil Kumar,5,Wonderful,"Certified Buyer, Manesar",Sunil Kumar,0,0,Good
962,Sayan  Khan,5,Super!,"Certified Buyer, Nuh",Sayan  Khan,0,0,Good
963,Nageswararao Ch,5,Classy product,"Certified Buyer, Hyderabad",Nageswararao Ch,0,0,Great 👍
964,Vamsi Kumar,5,Simply awesome,"Certified Buyer, Bengaluru",Vamsi Kumar,0,0,Simply superb
965,Rohit Sharma,4,Very Good,"Certified Buyer, Ganganagar District",Rohit Sharma,1,0,nice cool
966,Pravesh roy,5,Highly recommended,"Certified Buyer, Kolkata",Pravesh roy,1,0,nice display
967,Flipkart Customer,5,Worth every penny,"Certified Buyer, Bidar",Flipkart Customer,1,0,Great camera specially auto focus top notch performance
968,Rameez Raja,3,Fair,"Certified Buyer, Gurugram",Rameez Raja,1,0,"Normal iphone performance, nothing new. Average iphone."
969,Flipkart Customer,5,Terrific,"Certified Buyer, Pithoragarh",Flipkart Customer,1,0,Perfect colour... Looking at the next level with the apple symbol..
970,Ann Susan,4,Delightful,"Certified Buyer, Coimbatore",Ann Susan,1,0,Good.
971,Girish Rupak,5,Excellent for the price and premium apple device,"Certified Buyer, Bangalore",Girish Rupak,1,0,"All day Battery life, no heating, extreme smooth performace.I would suggest getting iphone 14 over iphone 13 as it has 2 extra GB ram iphon 13 pro processor"
972,UDAY KALYAN,5,Terrific,"Certified Buyer, Kurnool",UDAY KALYAN,1,0,Super
973,Sonu Gupta Customer,5,Must buy!,"Certified Buyer, Bengaluru",Sonu Gupta Customer,0,0,Phone is amzing performance superb display
974,Golu Gupta,5,Simply awesome,"Certified Buyer, Patna",Golu Gupta,1,0,I just want say that its a amazing phone i ever used and the performances are fabulous
975,Harshad Shetty,4,Pretty good,"Certified Buyer, Mumbai",Harshad Shetty,0,0,Great product and performance
976,Manju Malik,5,Perfect product!,"Certified Buyer, Faridabad",Manju Malik,1,0,Awesome
977,Sunil M Mantur,5,Must buy!,"Certified Buyer, Amreli",Sunil M Mantur,0,0,Product is superb and camera quality is excellent
978,Ajay Kumar  Tiwari,5,Mind-blowing purchase,"Certified Buyer, Indore",Ajay Kumar  Tiwari,1,0,Verry nice
979,Subrata Maiti,1,Did not meet expectations,"Certified Buyer, Medinipur",Subrata Maiti,0,0,My data cable is not working
980,Manish Thakur,5,Highly recommended,"Certified Buyer, Pattan",Manish Thakur,1,0,Great product
981,Prem Kumar,5,Terrific,"Certified Buyer, Madurai",Prem Kumar,1,0,Excallent item i phone 14
982,Ashish  Thakur,5,Terrific,"Certified Buyer, Jalandhar",Ashish  Thakur,0,0,Product is good
983,Gurkamal singh  Sandhu,5,Highly recommended,Certified Buyer,Gurkamal singh  Sandhu,1,0,Genuine  product and deliver on time .. thanks alot
984,Jan Mohammod  Sk,5,Simply awesome,"Certified Buyer, Bangalore",Jan Mohammod  Sk,0,0,Wow colour
985,Saibatapa Sen,5,Brilliant,"Certified Buyer, Maibong",Saibatapa Sen,0,0,"I am in love with this phone, the colour is awesome, picture quality unmatched. Worth the hype!"
986,Saini sarika,5,Fabulous!,"Certified Buyer, Hardwar District",Saini sarika,1,0,Quality awesome
987,HARSH PAWAR,5,Wonderful,"Certified Buyer, New Delhi",HARSH PAWAR,0,0,No words to write.  It's really awesome.
988,Akshay Vatere,5,Awesome,"Certified Buyer, Mumbai",Akshay Vatere,1,0,Design superb
989,Chirag Jethwa,5,Wonderful,"Certified Buyer, Mumbai",Chirag Jethwa,1,0,very nice
990,AJAY KUMAR SAKET,5,Terrific purchase,"Certified Buyer, Naudhia",AJAY KUMAR SAKET,1,0,I love I phone🥰🥰🥰🤗🤗🤗🤗
991,Nikhil  Parihar,5,Just wow!,"Certified Buyer, Jabalpur",Nikhil  Parihar,1,0,good
992,Thimmesh  K,5,Super!,"Certified Buyer, Bengaluru",Thimmesh  K,1,0,"Within one day we got  the delivery thanks Flipkart, nice  delivery person he showed everything in front of me am very much happy and satisfied with service and mobile it's my dream comes true 😍"
993,AHMAD RAJA,5,Brilliant,"Certified Buyer, Muzaffarpur",AHMAD RAJA,1,0,Superb ❤️
994,Mohit Shukla,5,Wonderful,"Certified Buyer, Thiruvananthapuram",Mohit Shukla,0,0,"We can say tha it is value for money product , great camera quality,  eye catching design."
995,Flipkart Customer,5,Fabulous!,"Certified Buyer, Nashik",Flipkart Customer,1,0,"Battery heats sometimes , and for those who are saying brightness is low there are two settings for brightness turn that on in accessibility go to display and text size and click the reduce  white point for bright display"
996,seden bhutia seden bhutia,3,Good,"Certified Buyer, Dharamshala",seden bhutia seden bhutia,1,0,Good phone
997,Ashi,5,Just wow!,"Certified Buyer, North West Delhi",Ashi,1,0,Wonderful
998,KHUSHBOO Bhatia,5,Brilliant,"Certified Buyer, New Delhi",KHUSHBOO Bhatia,1,0,Perfect
999,DEBASIS SAMAL,5,Wonderful,"Certified Buyer, Berhampur",DEBASIS SAMAL,1,0,Just shifted to iPhone from Android. Its Good.Good Battery Back Up. For normal use it's good.
1000,AVINASH singh,5,Excellent,"Certified Buyer, Neyveli",AVINASH singh,1,0,i have given gift to my wife on birthday 😍 updated from iphone 7 to iphone 14 .
1001,Feroz  Pasha,1,Waste of money!,"Certified Buyer, Ramagundam",Feroz  Pasha,0,0,Feeling bad shifting to ios pathetic experience my Samsung f12 far bbetter
1002,Flipkart Customer,4,Really Nice,"Certified Buyer, Nandivaram Guduvancheri",Flipkart Customer,1,0,Overall good delivery and quality
1003,Mahesh nagre,3,Nice,"Certified Buyer, Kalyan",Mahesh nagre,1,0,Nice phone with great performance and battery
1004,Ninja Kaushal,5,Simply awesome,"Certified Buyer, Bilaspur",Ninja Kaushal,0,0,Loved one🤌💕😍
1005,Rohit Sharma,5,Great product,"Certified Buyer, Greater Noida",Rohit Sharma,0,0,Good camera
1006,vishal maurya,5,Best in the market!,"Certified Buyer, New Delhi",vishal maurya,1,0,Excellent phone and outstanding camera
1007,Salman Khan,5,Perfect product!,"Certified Buyer, Siwan",Salman Khan,0,0,Fabulous
1008,Hemant  Singh,4,Value-for-money,"Certified Buyer, Kanpur",Hemant  Singh,1,0,Front Camera 3 to 4 star
1009,Sonu Nirala,5,Excellent,"Certified Buyer, Rajgir",Sonu Nirala,0,0,Exited
1010,KAILASH KUMAR,5,Highly recommended,"Certified Buyer, North West Delhi",KAILASH KUMAR,0,0,Amazing phone iphone 14 😍😍
1011,Adhyan Agarwal,5,Great product,"Certified Buyer, Kolkata",Adhyan Agarwal,0,0,BEST PHONE 📱
1012,Abhinav Singh,5,Fabulous!,"Certified Buyer, Ayodhya",Abhinav Singh,1,0,Amazing !!! don't think twice just go for it 🍎💙
1013,Amit Bansal,5,Terrific purchase,"Certified Buyer, Hisar",Amit Bansal,1,0,Nice...
1014,Vinod Murthy,4,Good quality product,"Certified Buyer, Bengaluru",Vinod Murthy,1,0,This is my first IPhone. Good to use and handy. Great performance too. Camera quality is very good and smooth.
1015,Rajesh Raji,5,Terrific purchase,"Certified Buyer, Chennai",Rajesh Raji,0,0,Soooperb camera and brilliant performance 😘😘😘😘😘😘
1016,Sintu Gorain,5,Best in the market!,"Certified Buyer, Chirkunda",Sintu Gorain,1,0,Good but small screen
1017,K.Rahul Rao,5,Great product,"Certified Buyer, Puri",K.Rahul Rao,1,0,"Camera: Rear Camera is Too GoodFront Camera : Average Performance : BeastSecurity : BestSoftware : BestiPhone 14 is a complete package, go for it without any hesitation. This phone changed me from Android Fanboy to iPhone fanboy."
1018,Rajesh,5,Classy product,"Certified Buyer, Gwalior",Rajesh,1,0,Very good and awesome Delivery is very Bad
1019,Rahul  vaishnav,3,Nice,"Certified Buyer, Dehradun",Rahul  vaishnav,1,0,I think this time apple surely has compromised with the display quality of the base variant.
1020,Flipkart Customer,5,Great product,"Certified Buyer, Bhubaneswar",Flipkart Customer,0,0,Just go for it don't even think of any another brand
1021,Gautie,5,Super!,"Certified Buyer, Tirupati",Gautie,1,0,Fantastic product from apple. Was worried about delivery. Flipkart has ensured safe and tension free delivery
1022,Ashutosh Kumar Nirala,5,Super!,"Certified Buyer, Saharsa",Ashutosh Kumar Nirala,1,0,OSM
1023,Parmanand  Garg,5,Great product,"Certified Buyer, Sunam",Parmanand  Garg,1,0,Good
1024,Satish P,4,Good choice,"Certified Buyer, Visakhapatnam",Satish P,1,0,Very good
1025,Shashank Kaundal,5,Worth every penny,"Certified Buyer, Pathankot",Shashank Kaundal,1,0,The battery life is best on iPhone
1026,Flipkart Customer,1,Waste of money!,"Certified Buyer, Guwahati",Flipkart Customer,1,0,Heating problem exists
1027,Flipkart Customer,5,Must buy!,"Certified Buyer, Supaul",Flipkart Customer,1,0,Very nice
1028,R sonu Customer,5,Great product,"Certified Buyer, Ranchi",R sonu Customer,1,0,Good and amazing product and camera are sexy
1029,puja giri,5,Worth every penny,"Certified Buyer, Gurugram",puja giri,1,0,Awesome bought it on flash sale days Awesome camera Awesome battery back up
1030,Ram Das,5,Great product,"Certified Buyer, New Delhi",Ram Das,1,0,Good
1031,Mayank  Jain,5,Super!,"Certified Buyer, New Delhi",Mayank  Jain,1,0,Best phone I have ever experienced.
1032,Gajanan  Punde,5,Just wow!,"Certified Buyer, Jalgaon Jamod",Gajanan  Punde,1,0,This my first I phone and I'm so happy
1033,Abhishek Kumar,4,Delightful,"Certified Buyer, Ghaziabad",Abhishek Kumar,1,0,good but price is high
1034,karan  yadav,5,Great product,"Certified Buyer, New Delhi",karan  yadav,1,0,I obsessed with my i phone 14
1035,Pragyesh  Rawat,5,Excellent,"Certified Buyer, Jhabua",Pragyesh  Rawat,1,0,"From Android to ios , Very good Experience , Videos and Photos Quality are Far Better than mobile I have used in the past"
1036,Nirav  Prajapati,4,Value-for-money,"Certified Buyer, Anand District",Nirav  Prajapati,1,0,Good phone Nice in one
1037,Sahana  Avinash ,5,Wonderful,"Certified Buyer, Bengaluru",Sahana  Avinash ,0,0,I love the phone i purchased it to gift my husband the camera battery everything is fine thanks a lot for the fast delivery
1038,Sorav Rajput,5,Brilliant,"Certified Buyer, Vidisha",Sorav Rajput,1,0,Thanks
1039,Cs shekhwat,5,Fabulous!,"Certified Buyer, Uttar Satali",Cs shekhwat,1,0,My dream phone
1040,Pritesh Dhakate,5,Classy product,"Certified Buyer, Mumbai",Pritesh Dhakate,1,0,Awesome product
1041,Flipkart Customer,5,Fabulous!,"Certified Buyer, Ahmedabad",Flipkart Customer,1,0,Excellent 👌
1042,Tejas  Dayatar,5,Wonderful,"Certified Buyer, Ahmedabad",Tejas  Dayatar,1,0,"amazing picture quality , love you Apple ."
1043,Debabrata Sarkar,5,Worth every penny,"Certified Buyer, Kolkata",Debabrata Sarkar,0,0,Nice product  i am so happy😊😊😊
1044,Flipkart Customer,4,Nice product,"Certified Buyer, Bengaluru",Flipkart Customer,0,0,Nice
1045,shubham Kumar,5,Super!,"Certified Buyer, Nalanda District",shubham Kumar,0,0,Wow
1046,Rishi  Hurkat,5,Fabulous!,"Certified Buyer, Bina",Rishi  Hurkat,0,0,Superb product love it ❤️
1047,Flipkart Customer,5,Fabulous!,"Certified Buyer, Ghaziabad",Flipkart Customer,1,0,iPhone 14 amazing phone and flip kart delivery excellent service provide
1048,Saurabh sharma ,5,Super!,"Certified Buyer, Rishikesh",Saurabh sharma ,1,0,Great phone with great features..
1049,mansoor ali shaikh,5,Super!,"Certified Buyer, Mumbai",mansoor ali shaikh,1,0,All is good
1050,Rocky R,5,Terrific purchase,"Certified Buyer, Bengaluru",Rocky R,1,0,Very good product
1051,Sandeep kumar verma,5,Wonderful,"Certified Buyer, New Delhi",Sandeep kumar verma,1,0,Apple always doing best
1052,Anubhav Gautam,5,Simply awesome,"Certified Buyer, Shahdara",Anubhav Gautam,1,0,"Best In Segment and blue colour looking super, camera best ever and best phone ever"
1053,jameen jabri,5,Terrific purchase,"Certified Buyer, Kannur District",jameen jabri,1,0,Excellent product  loved it recommended
1054,Monu  Kapoor,5,Mind-blowing purchase,"Certified Buyer, Rudrapur",Monu  Kapoor,1,0,Very nice phone iPhone 14 Great !!!!!!
1055,Mahesh sakole,5,Excellent,"Certified Buyer, Kinwat",Mahesh sakole,1,0,Just awesome
1056,Flipkart Customer,5,Fabulous!,"Certified Buyer, Salar",Flipkart Customer,1,0,Beautiful great value for money
1057,Abhinaw Kumar,5,Worth every penny,"Certified Buyer, Pathankot District",Abhinaw Kumar,1,0,Fine
1058,sagar dimble,4,Nice product,"Certified Buyer, Pune",sagar dimble,402,1447,camera is not as expected at evening as pictures are so dull and not bright.so much dissipointed when compare camera even with s21fe or one plus nord or other premium phones.at bright sunlight or in a bright light at night pictures are so good in portrait mode.selfies in low light are terrible. looks like camera under 10k phone.battery is good and last for day easily.performance is so good.display may be if 90hz it will be good at this price range.
1059,Venkat Dasari,5,Terrific purchase,"Certified Buyer, Kurnool District",Venkat Dasari,4,7,Every is forfect disine battary camera every thing ilovit im giving 5 star rating abow im yousing iPhone 3GS to 14 im using present iPhone 11 Pro Max thats taking yellow colour mobile disine also every thing 5star
1060,Bharat  Adate,5,Brilliant,"Certified Buyer, Waluj Midc",Bharat  Adate,7,12,good design good cameragood battery backup best mobile
1061,puni ram,5,Classy product,"Certified Buyer, Singrauli",puni ram,4,5,Nice
1062,Sanjay Gupta,5,Worth every penny,"Certified Buyer, Mumbai",Sanjay Gupta,3,3,Product is awesome but battery drain problems
1063,Abhinav Gupta,4,Wonderful,"Certified Buyer, Kanpur",Abhinav Gupta,3,3,"Good performance, screen quality but camera quality is okay but I would expect better than this in case of night mode."
1064,Vasanth,1,Worthless,"Certified Buyer, Karur",Vasanth,3,3,Not worth as hype by people giving comments.Not easy for day to day activities.Old-age caller id.Avg camera performance
1065,Ashutosh kumar Singh,5,Awesome,"Certified Buyer, Visakhapatnam",Ashutosh kumar Singh,3,3,"What a phone, first time i purchased the I phone over Android, and fully satisfied on every acepects. Camera undoubtedly ossaam. RAM and storage also nice. No lagging , smooth performance. Build quality too good. UI extraordinary. Overall value for money product."
1066,Paramjeet singh,5,Terrific,"Certified Buyer, Lucknow",Paramjeet singh,3,4,Excellent smart phone under best price😎
1067,Parvej  Ali,5,Must buy!,"Certified Buyer, Gwalior",Parvej  Ali,3,4,Excellent Feacture And Camera And Mobile
1068,Mahesh S,1,Don't waste your money,"Certified Buyer, Adoor",Mahesh S,2,2,"worst packing....why are you taking package fees for this products ?? not bubble wrapped, not even give any extra protection in the box 🙏🙏  worst customer service also so am giving only 1 star because of this 👍"
1069,Rohini chatki,1,Unsatisfactory,"Certified Buyer, Nagpur",Rohini chatki,1,2,Phone is too much heating just in 10min while charging
1070,Dr Neha Bishnoi,5,Fabulous!,"Certified Buyer, Lucknow",Dr Neha Bishnoi,2,2,I mean it's alright. Overatted af in my opinion.
1071,Iglutech  Electronics,1,Waste of money!,"Certified Buyer, Mahesana",Iglutech  Electronics,2,2,Call network voice call not performing
1072,Zoheb  Quamar,5,Super!,"Certified Buyer, New Delhi",Zoheb  Quamar,2,2,Superb 😎
1073,Selva Kumar,1,Waste of money!,"Certified Buyer, Chennai",Selva Kumar,2,2,Charger not available in box waste for money camera using time over heating issue
1074,Shubham  Sharma,1,Did not meet expectations,"Certified Buyer, Mangrol",Shubham  Sharma,1,2,Slow process
1075,Sankar Dasgupta,1,Unsatisfactory,"Certified Buyer, Memari",Sankar Dasgupta,1,2,BATTERY BACKUP NOT BATTER.
1076,Sunny Málík,5,Classy product,"Certified Buyer, Rohtak",Sunny Málík,2,2,Best phone
1077,Babita Verma,5,Perfect product!,"Certified Buyer, Kangra District",Babita Verma,1,1,My first experience with apple phone is great…This phone is awesome and I love light purple colour…i m so happy thank u Flipkart 🥰
1078,Ankit Sharma,5,Excellent,"Certified Buyer, Bengaluru",Ankit Sharma,2,2,"First time iphone user, liking it very much. Battery is good and fast charging is an additional advantage."
1079,Flipkart Customer,5,Worth every penny,"Certified Buyer, Bhopal",Flipkart Customer,1,2,"Best Deal with Flipkart, best Phone"
1080,Sanaullah Khan,5,Simply awesome,"Certified Buyer, Bachhraon",Sanaullah Khan,2,2,Great product much faster than iPhone 13
1081,Amanpreet Singh,3,Does the job,"Certified Buyer, Tarantaran",Amanpreet Singh,2,2,Overall good performance
1082,Mayank Rikhari,3,Nice,"Certified Buyer, Noida",Mayank Rikhari,4,8,Awesome
1083,Sandeep Bhardwaj,1,Hated it!,"Certified Buyer, New Delhi",Sandeep Bhardwaj,12,39,Bad
1084,Flipkart Customer,5,Worth every penny,"Certified Buyer, New Delhi",Flipkart Customer,3,5,"Loved it, my first iphone btw box quality wasnt good"
1085,Manjarul Hoque,1,Useless product,"Certified Buyer, Maldah District",Manjarul Hoque,7,21,"Only performance good.. battery service is very bad, display size or feel  2014 genaration phone, oneplus, nothing phone is best.."
1086,Abishek Bhattacherjee,5,Just wow!,"Certified Buyer, Siliguri",Abishek Bhattacherjee,7,22,Totally worth selling your kidney and buying this amazing phone. Camera makes this phone A+
1087,Flipkart Customer,3,Just okay,"Certified Buyer, Puthencruz",Flipkart Customer,2,3,"Mediocre Performance for the Prices I recently purchased this phone for 50K, and I must admit, I'm not entirely thrilled with it. Here's a breakdown of my experience:Camera (3/5): The camera performance falls flat, earning a modest 3 out of 5. While it's not terrible, it doesn't quite meet the expectations I had for a device in this price range.Performance: This is where I encountered some major issues. The phone has a tendency to hang, and there are times when it takes multiple attempt..."
1088,Akshay Raghav,1,Useless product,"Certified Buyer, Gurugram",Akshay Raghav,1,3,"Freezes a lot, camera and display are not average which is not expected from an iphone"
1089,Akshit Kanaujia Akshit Kanaujia,5,Terrific purchase,"Certified Buyer, Kanpur",Akshit Kanaujia Akshit Kanaujia,2,3,Just awesome.
1090,Arshpreet Singh,1,Very poor,"Certified Buyer, Ghaziabad",Arshpreet Singh,2,2,"I am facing too many glitches in this phone, Screen is freezing whenever I am trying to unlock my phone."
1091,vijay  sangtani,5,Terrific purchase,"Certified Buyer, Jodhpur",vijay  sangtani,4,16,thankssss filpkart 😘😘😘😘
1092,Prabhat Kumar,3,Does the job,"Certified Buyer, Sitamarhi District",Prabhat Kumar,3,8,Its picture quality low
1093,Agrim Kalas,5,Fabulous!,"Certified Buyer, Jammu",Agrim Kalas,1,3,jeeeeeeeeeeeeeeeeeeeeeeeeeeeeeeeeeeeeeeeeeeeeeeeeeeeeeez okay
1094,Suresh Reddy,1,Worthless,"Certified Buyer, Bengaluru",Suresh Reddy,2,4,Price should be little bit less poor people can't afford this..
1095,Soumya Kar,3,Good,"Certified Buyer, Baleshwar",Soumya Kar,2,4,Automatic call recorder not there like Samsung. The biggest draw back. Camera quality not as expected.
1096,pritam dey,2,Expected a better product,"Certified Buyer, Chennai",pritam dey,1,1,Battery quality is not good it's too much consume bettery helth + bettery backup
1097,Swapnil Bale,5,Must buy!,"Certified Buyer, Davorlim",Swapnil Bale,1,1,"Superb, camera quality of iphone 13 is better than iPhone 14"
1098,Amresh Kumar,4,Worth the money,"Certified Buyer, Chandauli",Amresh Kumar,1,1,Very good 👍
1099,Kartick Midyadas,2,Expected a better product,"Certified Buyer, Bardhaman",Kartick Midyadas,1,1,Getting hot first..and battery draining.while very few apps in back ground..disappointing performance by I phone 14
1100,shivangi rai,5,Just wow!Not a brick but a phone,"Certified Buyer, Varanasi",shivangi rai,1,1,I was so worried getting a phone from Flipkart (heard all the news of epople getting bricks instead) but I am happy I got my actual phone phew :)
1101,Akshay Salunkhe ,5,Classy product,"Certified Buyer, Pimpri Chinchwad",Akshay Salunkhe ,1,1,One of the best choice to select iphone 14 with 256gb memory.
1102,Deep  Das,5,Just wow!,"Certified Buyer, Nadia District",Deep  Das,1,1,Battery backup of this device is unbeatable in one charge this device can last upto 1/5 days The camera quality is fabulous performance is top notch overall loved this device and also flipkarts delivery is very good ❤️❤️❤️❤️❤️
1103,Ishant Bisht,2,Bad quality,"Certified Buyer, Dehradun",Ishant Bisht,1,1,Massive battery drain problem
1104,Flipkart Customer,1,Utterly Disappointed,"Certified Buyer, Kanpur",Flipkart Customer,1,1,There is a minimal gap between screen and upper frame
